{
  "schema": "harness-contract.v1",
  "harness": {"id": "pi", "surface": "cli"},
  "binary": {"command": "pi", "version_args": ["--version"]},
  "capabilities": [
    {"id": "instructions", "claim": "Settings are documented.", "provenance": "documented", "support_state": "native", "implementation_layers": ["native"], "evidence": [{"kind": "vendor_documentation", "reference": "https://pi.dev/docs/latest/settings"}], "tested_version": "0.80.6", "platform": "linux", "scope": "project"},
    {"id": "skills", "claim": "Extensions compose skills.", "provenance": "documented", "support_state": "advisory", "implementation_layers": ["extension_composed"], "evidence": [{"kind": "vendor_documentation", "reference": "https://pi.dev/docs/latest/extensions"}], "tested_version": "0.80.6", "platform": "linux", "scope": "extension"},
    {"id": "hooks", "claim": "Extensions compose event hooks.", "provenance": "documented", "support_state": "advisory", "implementation_layers": ["extension_composed"], "evidence": [{"kind": "vendor_documentation", "reference": "https://pi.dev/docs/latest/extensions"}], "tested_version": "0.80.6", "platform": "linux", "scope": "extension"},
    {"id": "mcp", "claim": "Core MCP was not established by the probe.", "provenance": "unknown", "support_state": "unsupported", "implementation_layers": ["extension_composed"], "evidence": [{"kind": "probe_receipt", "reference": "probe_pi/.brigade/work/verify-runs/20260718-044954-work-verify-e85ad4/receipt.json"}], "tested_version": "0.80.6", "platform": "linux", "scope": "core"},
    {"id": "workspace", "claim": "Settings scope is documented.", "provenance": "documented", "support_state": "native", "implementation_layers": ["native"], "evidence": [{"kind": "vendor_documentation", "reference": "https://pi.dev/docs/latest/settings"}], "tested_version": "0.80.6", "platform": "linux", "scope": "project"},
    {"id": "session", "claim": "Session format is documented.", "provenance": "documented", "support_state": "native", "implementation_layers": ["native"], "evidence": [{"kind": "vendor_documentation", "reference": "https://pi.dev/docs/latest/session-format"}], "tested_version": "0.80.6", "platform": "linux", "scope": "session"},
    {"id": "verification", "claim": "Extension-composed only.", "provenance": "inferred", "support_state": "advisory", "implementation_layers": ["extension_composed"], "evidence": [{"kind": "vendor_documentation", "reference": "https://pi.dev/docs/latest/extensions"}], "tested_version": "0.80.6", "platform": "linux", "scope": "extension"},
    {"id": "handoff", "claim": "Extension-composed only.", "provenance": "inferred", "support_state": "advisory", "implementation_layers": ["extension_composed"], "evidence": [{"kind": "vendor_documentation", "reference": "https://pi.dev/docs/latest/extensions"}], "tested_version": "0.80.6", "platform": "linux", "scope": "extension"},
    {"id": "reload", "claim": "Reload is documented for extensions.", "provenance": "documented", "support_state": "advisory", "implementation_layers": ["extension_composed"], "evidence": [{"kind": "vendor_documentation", "reference": "https://pi.dev/docs/latest/extensions"}], "tested_version": "0.80.6", "platform": "linux", "scope": "extension"},
    {"id": "telemetry", "claim": "Telemetry was not probed.", "provenance": "unknown", "support_state": "unsupported", "implementation_layers": ["unknown"], "evidence": [{"kind": "probe_receipt", "reference": "probe_pi/.brigade/work/verify-runs/20260718-044954-work-verify-e85ad4/receipt.json"}], "tested_version": "0.80.6", "platform": "linux", "scope": "unprobed"},
    {"id": "platform", "claim": "Linux package metadata was observed.", "provenance": "observed", "support_state": "native", "implementation_layers": ["native"], "evidence": [{"kind": "local_probe", "reference": "probe_pi/.brigade/work/verify-runs/20260718-044954-work-verify-e85ad4/receipt.json"}], "tested_version": "0.80.6", "platform": "linux", "scope": "native"}
  ],
  "deep_probes": {"instruction": "declared", "skill": "declared", "hook": "declared", "mcp": "declared", "workspace": "declared", "session": "declared", "verification": "declared", "handoff": "declared", "reload": "declared", "telemetry": "declared", "platform": "declared"}
}
