{
  "schema": "harness-contract.v1",
  "harness": {"id": "antigravity", "surface": "gui"},
  "binary": {"command": "agy", "version_args": ["--version"]},
  "availability": {"command_candidates": ["agy", "antigravity"]},
  "capabilities": [
    {"id": "instructions", "claim": "Skills codelab exists, but no local binary was available.", "provenance": "documented", "support_state": "externally_blocked", "implementation_layers": ["unknown"], "evidence": [{"kind": "vendor_documentation", "reference": "https://codelabs.developers.google.com/getting-started-with-antigravity-skills"}], "tested_version": null, "platform": "linux", "scope": "externally blocked"},
    {"id": "skills", "claim": "Skills are documented, runtime unavailable.", "provenance": "documented", "support_state": "externally_blocked", "implementation_layers": ["unknown"], "evidence": [{"kind": "vendor_documentation", "reference": "https://codelabs.developers.google.com/getting-started-with-antigravity-skills"}], "tested_version": null, "platform": "linux", "scope": "externally blocked"},
    {"id": "hooks", "claim": "Unavailable for runtime probe.", "provenance": "unknown", "support_state": "externally_blocked", "implementation_layers": ["unknown"], "evidence": [{"kind": "probe_receipt", "reference": "probe_antigravity/.brigade/work/verify-runs/20260718-044954-work-verify-680cf2/receipt.json"}], "tested_version": null, "platform": "linux", "scope": "externally blocked"},
    {"id": "mcp", "claim": "Unavailable for runtime probe.", "provenance": "unknown", "support_state": "externally_blocked", "implementation_layers": ["unknown"], "evidence": [{"kind": "probe_receipt", "reference": "probe_antigravity/.brigade/work/verify-runs/20260718-044954-work-verify-680cf2/receipt.json"}], "tested_version": null, "platform": "linux", "scope": "externally blocked"},
    {"id": "workspace", "claim": "Unavailable for runtime probe.", "provenance": "unknown", "support_state": "externally_blocked", "implementation_layers": ["unknown"], "evidence": [{"kind": "probe_receipt", "reference": "probe_antigravity/.brigade/work/verify-runs/20260718-044954-work-verify-680cf2/receipt.json"}], "tested_version": null, "platform": "linux", "scope": "externally blocked"},
    {"id": "session", "claim": "Unavailable for runtime probe.", "provenance": "unknown", "support_state": "externally_blocked", "implementation_layers": ["unknown"], "evidence": [{"kind": "probe_receipt", "reference": "probe_antigravity/.brigade/work/verify-runs/20260718-044954-work-verify-680cf2/receipt.json"}], "tested_version": null, "platform": "linux", "scope": "externally blocked"},
    {"id": "verification", "claim": "Brigade adapter remains advisory.", "provenance": "inferred", "support_state": "advisory", "implementation_layers": ["brigade_adapter"], "evidence": [{"kind": "probe_receipt", "reference": "probe_antigravity/.brigade/work/verify-runs/20260718-044954-work-verify-680cf2/receipt.json"}], "tested_version": null, "platform": "linux", "scope": "Brigade adapter"},
    {"id": "handoff", "claim": "Brigade adapter remains advisory.", "provenance": "inferred", "support_state": "advisory", "implementation_layers": ["brigade_adapter"], "evidence": [{"kind": "probe_receipt", "reference": "probe_antigravity/.brigade/work/verify-runs/20260718-044954-work-verify-680cf2/receipt.json"}], "tested_version": null, "platform": "linux", "scope": "Brigade adapter"},
    {"id": "reload", "claim": "Unavailable for runtime probe.", "provenance": "unknown", "support_state": "externally_blocked", "implementation_layers": ["unknown"], "evidence": [{"kind": "probe_receipt", "reference": "probe_antigravity/.brigade/work/verify-runs/20260718-044954-work-verify-680cf2/receipt.json"}], "tested_version": null, "platform": "linux", "scope": "externally blocked"},
    {"id": "telemetry", "claim": "Unavailable for runtime probe.", "provenance": "unknown", "support_state": "externally_blocked", "implementation_layers": ["unknown"], "evidence": [{"kind": "probe_receipt", "reference": "probe_antigravity/.brigade/work/verify-runs/20260718-044954-work-verify-680cf2/receipt.json"}], "tested_version": null, "platform": "linux", "scope": "externally blocked"},
    {"id": "platform", "claim": "Neither agy nor antigravity was available on Linux or native Windows command probes.", "provenance": "observed", "support_state": "externally_blocked", "implementation_layers": ["unknown"], "evidence": [{"kind": "probe_receipt", "reference": "probe_antigravity/.brigade/work/verify-runs/20260718-044954-work-verify-680cf2/receipt.json"}, {"kind": "direct_probe", "reference": "docs/research/evidence/direct-native-windows-command-probe-2026-07-18.json"}], "tested_version": null, "platform": "linux and windows", "scope": "externally blocked"}
  ],
  "deep_probes": {"instruction": "declared", "skill": "declared", "hook": "declared", "mcp": "declared", "workspace": "declared", "session": "declared", "verification": "declared", "handoff": "declared", "reload": "declared", "telemetry": "declared", "platform": "declared"}
}
