{
  "schema": "harness-contract.v1",
  "harness": {"id": "cursor-cli", "surface": "cli"},
  "binary": {"command": "cursor-agent", "version_args": ["--version"]},
  "capabilities": [
    {"id": "instructions", "claim": "Rules are documented.", "provenance": "documented", "support_state": "native", "implementation_layers": ["native"], "evidence": [{"kind": "vendor_documentation", "reference": "https://docs.cursor.com/context/rules"}], "tested_version": "2026.07.16-899851b", "platform": "linux", "scope": "project"},
    {"id": "skills", "claim": "Skill loading was not documented in the supplied Cursor sources.", "provenance": "unknown", "support_state": "unsupported", "implementation_layers": ["unknown"], "evidence": [{"kind": "probe_receipt", "reference": "probe_cursor/.brigade/work/verify-runs/20260718-044953-work-verify-a284a1/receipt.json"}], "tested_version": "2026.07.16-899851b", "platform": "linux", "scope": "unprobed"},
    {"id": "hooks", "claim": "Hook behavior was not probed.", "provenance": "unknown", "support_state": "unsupported", "implementation_layers": ["unknown"], "evidence": [{"kind": "probe_receipt", "reference": "probe_cursor/.brigade/work/verify-runs/20260718-044953-work-verify-a284a1/receipt.json"}], "tested_version": "2026.07.16-899851b", "platform": "linux", "scope": "unprobed"},
    {"id": "mcp", "claim": "MCP is available through documented CLI usage.", "provenance": "documented", "support_state": "native", "implementation_layers": ["native"], "evidence": [{"kind": "vendor_documentation", "reference": "https://docs.cursor.com/en/cli/using"}], "tested_version": "2026.07.16-899851b", "platform": "linux", "scope": "CLI"},
    {"id": "workspace", "claim": "CLI workspace use is documented.", "provenance": "documented", "support_state": "native", "implementation_layers": ["native"], "evidence": [{"kind": "vendor_documentation", "reference": "https://docs.cursor.com/en/cli/using"}], "tested_version": "2026.07.16-899851b", "platform": "linux", "scope": "CLI"},
    {"id": "session", "claim": "Session behavior was not probed.", "provenance": "unknown", "support_state": "unsupported", "implementation_layers": ["unknown"], "evidence": [{"kind": "probe_receipt", "reference": "probe_cursor/.brigade/runs/20260718-044429-fce38b9d"}], "tested_version": "2026.07.16-899851b", "platform": "linux", "scope": "unprobed"},
    {"id": "verification", "claim": "Brigade verification is adapter-level.", "provenance": "inferred", "support_state": "advisory", "implementation_layers": ["brigade_adapter"], "evidence": [{"kind": "probe_receipt", "reference": "probe_cursor/.brigade/work/verify-runs/20260718-044953-work-verify-a284a1/receipt.json"}], "tested_version": "2026.07.16-899851b", "platform": "linux", "scope": "Brigade adapter"},
    {"id": "handoff", "claim": "Brigade handoff is adapter-level.", "provenance": "inferred", "support_state": "advisory", "implementation_layers": ["brigade_adapter"], "evidence": [{"kind": "probe_receipt", "reference": "probe_cursor/.brigade/work/verify-runs/20260718-044953-work-verify-a284a1/receipt.json"}], "tested_version": "2026.07.16-899851b", "platform": "linux", "scope": "Brigade adapter"},
    {"id": "reload", "claim": "Reload was not probed.", "provenance": "unknown", "support_state": "unsupported", "implementation_layers": ["unknown"], "evidence": [{"kind": "probe_receipt", "reference": "probe_cursor/.brigade/runs/20260718-044429-fce38b9d"}], "tested_version": "2026.07.16-899851b", "platform": "linux", "scope": "unprobed"},
    {"id": "telemetry", "claim": "Telemetry was not probed.", "provenance": "unknown", "support_state": "unsupported", "implementation_layers": ["unknown"], "evidence": [{"kind": "probe_receipt", "reference": "probe_cursor/.brigade/runs/20260718-044429-fce38b9d"}], "tested_version": "2026.07.16-899851b", "platform": "linux", "scope": "unprobed"},
    {"id": "platform", "claim": "Linux CLI and native Windows CLI versions were observed separately.", "provenance": "observed", "support_state": "native", "implementation_layers": ["native"], "evidence": [{"kind": "local_probe", "reference": "probe_cursor/.brigade/work/verify-runs/20260718-044953-work-verify-a284a1/receipt.json"}, {"kind": "direct_probe", "reference": "docs/research/evidence/direct-native-windows-command-probe-2026-07-18.json"}], "tested_version": "2026.07.16-899851b", "platform": "linux", "scope": "native"}
  ],
  "deep_probes": {"instruction": "declared", "skill": "declared", "hook": "declared", "mcp": "declared", "workspace": "declared", "session": "declared", "verification": "declared", "handoff": "declared", "reload": "declared", "telemetry": "declared", "platform": "declared"}
}
