{
  "schema": "harness-contract.v1",
  "harness": {"id": "openclaw", "surface": "cli"},
  "binary": {"command": "openclaw", "version_args": ["--version"]},
  "capabilities": [
    {"id": "instructions", "claim": "Agent concepts are documented.", "provenance": "documented", "support_state": "native", "implementation_layers": ["native"], "evidence": [{"kind": "vendor_documentation", "reference": "https://docs.openclaw.ai/concepts/agent"}], "tested_version": "2026.7.1-beta.2", "platform": "linux", "scope": "agent"},
    {"id": "skills", "claim": "Skills are documented.", "provenance": "documented", "support_state": "native", "implementation_layers": ["native"], "evidence": [{"kind": "vendor_documentation", "reference": "https://docs.openclaw.ai/skills"}], "tested_version": "2026.7.1-beta.2", "platform": "linux", "scope": "agent"},
    {"id": "hooks", "claim": "Not probed.", "provenance": "unknown", "support_state": "unsupported", "implementation_layers": ["unknown"], "evidence": [{"kind": "probe_receipt", "reference": "probe_openclaw/.brigade/work/verify-runs/20260718-044954-work-verify-3b30f4/receipt.json"}], "tested_version": "2026.7.1-beta.2", "platform": "linux", "scope": "unprobed"},
    {"id": "mcp", "claim": "Not probed.", "provenance": "unknown", "support_state": "unsupported", "implementation_layers": ["unknown"], "evidence": [{"kind": "probe_receipt", "reference": "probe_openclaw/.brigade/work/verify-runs/20260718-044954-work-verify-3b30f4/receipt.json"}], "tested_version": "2026.7.1-beta.2", "platform": "linux", "scope": "unprobed"},
    {"id": "workspace", "claim": "Agent workspace is documented.", "provenance": "documented", "support_state": "native", "implementation_layers": ["native"], "evidence": [{"kind": "vendor_documentation", "reference": "https://docs.openclaw.ai/concepts/agent"}], "tested_version": "2026.7.1-beta.2", "platform": "linux", "scope": "agent"},
    {"id": "session", "claim": "Not probed.", "provenance": "unknown", "support_state": "unsupported", "implementation_layers": ["unknown"], "evidence": [{"kind": "probe_receipt", "reference": "probe_openclaw/.brigade/work/verify-runs/20260718-044954-work-verify-3b30f4/receipt.json"}], "tested_version": "2026.7.1-beta.2", "platform": "linux", "scope": "unprobed"},
    {"id": "verification", "claim": "Brigade adapter only.", "provenance": "inferred", "support_state": "advisory", "implementation_layers": ["brigade_adapter"], "evidence": [{"kind": "probe_receipt", "reference": "probe_openclaw/.brigade/work/verify-runs/20260718-044954-work-verify-3b30f4/receipt.json"}], "tested_version": "2026.7.1-beta.2", "platform": "linux", "scope": "Brigade adapter"},
    {"id": "handoff", "claim": "Brigade adapter only.", "provenance": "inferred", "support_state": "advisory", "implementation_layers": ["brigade_adapter"], "evidence": [{"kind": "probe_receipt", "reference": "probe_openclaw/.brigade/work/verify-runs/20260718-044954-work-verify-3b30f4/receipt.json"}], "tested_version": "2026.7.1-beta.2", "platform": "linux", "scope": "Brigade adapter"},
    {"id": "reload", "claim": "Not probed.", "provenance": "unknown", "support_state": "unsupported", "implementation_layers": ["unknown"], "evidence": [{"kind": "probe_receipt", "reference": "probe_openclaw/.brigade/work/verify-runs/20260718-044954-work-verify-3b30f4/receipt.json"}], "tested_version": "2026.7.1-beta.2", "platform": "linux", "scope": "unprobed"},
    {"id": "telemetry", "claim": "Not probed.", "provenance": "unknown", "support_state": "unsupported", "implementation_layers": ["unknown"], "evidence": [{"kind": "probe_receipt", "reference": "probe_openclaw/.brigade/work/verify-runs/20260718-044954-work-verify-3b30f4/receipt.json"}], "tested_version": "2026.7.1-beta.2", "platform": "linux", "scope": "unprobed"},
    {"id": "platform", "claim": "Linux version was receipt-backed.", "provenance": "observed", "support_state": "native", "implementation_layers": ["native"], "evidence": [{"kind": "local_probe", "reference": "probe_openclaw/.brigade/work/verify-runs/20260718-044954-work-verify-3b30f4/receipt.json"}], "tested_version": "2026.7.1-beta.2", "platform": "linux", "scope": "native"}
  ],
  "deep_probes": {"instruction": "declared", "skill": "declared", "hook": "declared", "mcp": "declared", "workspace": "declared", "session": "declared", "verification": "declared", "handoff": "declared", "reload": "declared", "telemetry": "declared", "platform": "declared"}
}
